{
  "extensions": [
    {
      "details": "extensions/369431.inner-mismatch.json",
      "detailsSha256": "27f06970e3684e53f7aa5d0a53c485cc87863c26db24d24830b7a25ec2f7b0fe",
      "id": "369431.inner-mismatch",
      "latestVersion": "1.1.9",
      "name": "快递异常标记",
      "publisher": {
        "displayName": "369431",
        "id": "369431"
      },
      "riskLabels": [
        "external-program"
      ],
      "sourceAvailability": "open-source",
      "summary": "录制时一键标记内物不符：写进录像水印并生成异常记录，事后按状态处理",
      "trust": "third-party",
      "type": "external-adapter"
    },
    {
      "details": "extensions/369431.kuaimai-erp.json",
      "detailsSha256": "d281e5eedc304c1565180a93f49feaf143160897e6f10a5603cab55fcd65a869",
      "id": "369431.kuaimai-erp",
      "latestVersion": "1.0.4",
      "name": "快麦 ERP 适配器",
      "publisher": {
        "displayName": "369431",
        "id": "369431"
      },
      "riskLabels": [
        "external-program"
      ],
      "sourceAvailability": "open-source",
      "summary": "把 PackingProof 扫码任务接入快麦 ERP，自动查询并回传订单、件数和退款状态",
      "trust": "third-party",
      "type": "external-adapter"
    },
    {
      "details": "extensions/369431.wechat-recording-bot.json",
      "detailsSha256": "0e9fac889c108f121040286afdb56e84a2d367e342825d4f9628e7aa6a46400e",
      "id": "369431.wechat-recording-bot",
      "latestVersion": "1.0.0",
      "name": "企业微信机器人",
      "publisher": {
        "displayName": "369431",
        "id": "369431"
      },
      "riskLabels": [
        "external-program"
      ],
      "sourceAvailability": "open-source",
      "summary": "在企业微信群发送快递单号即可查询并回传打包录像，频道化架构可扩展接入更多聊天平台",
      "trust": "third-party",
      "type": "external-adapter"
    },
    {
      "details": "extensions/gude55.pinduoduo-orders.json",
      "detailsSha256": "02d4e1958a84dfb6477e3d9a3ed2a1d65ddab2a8628ed460510eb3c4a485039d",
      "id": "gude55.pinduoduo-orders",
      "latestVersion": "3.6",
      "name": "拼多多打单订单联动",
      "publisher": {
        "displayName": "gude55",
        "id": "gude55"
      },
      "riskLabels": [],
      "sourceAvailability": "open-source",
      "summary": "从拼多多官方打单页面读取订单、备注与商品数量，推送到已配置的 PackingProof 录像设备",
      "trust": "third-party",
      "type": "userscript"
    },
    {
      "details": "extensions/packingproof.kdzs.json",
      "detailsSha256": "82f93d08b2288199b974a1e23425e10b35e5eef6d57317553fa8537695d8f960",
      "id": "packingproof.kdzs",
      "latestVersion": "2.18",
      "name": "快递助手订单联动",
      "publisher": {
        "displayName": "PackingProof",
        "id": "packingproof"
      },
      "riskLabels": [],
      "sourceAvailability": "open-source",
      "summary": "从快递助手页面读取订单、备注和退款状态，并发送到已配置的录像设备或保存主机",
      "trust": "official",
      "type": "userscript"
    },
    {
      "details": "extensions/packingproof.qqbot.json",
      "detailsSha256": "9058ced1e82c763a2ee83805ab2b06922c65a3c6e458e9d5c29097b47321d8df",
      "id": "packingproof.qqbot",
      "latestVersion": "0.0.10",
      "name": "QQ 机器人",
      "publisher": {
        "displayName": "PackingProof",
        "id": "packingproof"
      },
      "riskLabels": [
        "external-program"
      ],
      "sourceAvailability": "open-source",
      "summary": "通过 QQ 私聊或群聊按快递单号查询并发送打包录像",
      "trust": "official",
      "type": "external-adapter"
    }
  ],
  "schemaVersion": 1,
  "sourceDigest": "80b37964fce30ef4617bd3cfd2c6e70a76d01a517db383a1b19a90aca2200bf8",
  "updatedAt": "2026-10-21T00:31:47+08:00"
}
